Article Title	Description	Coding
The Marvels Director Nia DaCosta Wants To Unite Two X-Men Heroes Next	The Marvels Director Nia DaCosta Wants To Unite Two X-Men Heroes Next Following her admirable contribution to the Candyman franchise, director Nia DaCosta has been on the rise. In the "Captain Marvel" sequel, "The Marvels," the filmmaker reunites with "Candym…	\s
Rachel Zegler Replaces Failing ‘Snow White’ Role With New Character	Did Rachel Zegler make the same mistake twice? Let’s find out. Rachel Zegler has been a budding star in Hollywood and cannot seem to stop booking leading roles in some of the year’s (and following years) most anticipated films. If you’ve been keeping up with …	\s
What Happened To Lucy Gray After Ballad Of Songbirds & Snakes Ending? Rachel Zegler Has Thoughts	Rachel Zegler weighs in on the mystery of what happened to Lucy Gray Baird after the ambiguous ending of The Ballad of Songbirds and Snakes.	\s
The Holdovers Is a Cozy ’70s Throwback With One Big Difference	Paul Giamatti invests his withering remarks with a French pastry’s worth of layers.	\s
‘The Marvels’ melts down at the box office, marking a new low for the MCU	The superhero factory hit a new low with the weekend launch of “The Marvels,” which opened with just $47 million, […]
The post ‘The Marvels’ melts down at the box office, marking a new low for the MCU appeared first on TheGrio.	\s
Thanksgiving Review	Eli Roth delivers a solid slasher flick that features some truly incredible practical FX and killer stalking sequences.
The post Thanksgiving Review appeared first on JoBlo.	\s
Emerald Fennell Soaks in Sexy Boys and Sleepy Class Satire in Saltburn: Review	In the filmmaker's followup to Promising Young Woman, Barry Keoghan smolders and schemes.
Emerald Fennell Soaks in Sexy Boys and Sleepy Class Satire in Saltburn: Review
Clint Worthington	\s
Addison Rae Returns to Red Carpet For First Time in 9 Months at 'Thanksgiving' Premiere	Addison Rae wears a sheer look while stepping out for the premiere of her new movie Thanksgiving held at Vista Theatre on Tuesday (November 14) in Los Angeles. This is the first time the 23-year-old TikTok star turned actress has been on the red carpet nearly…	\s
‘Priscilla’ Costume Designer Stacey Battat On Capturing Reality Through The Style Of Two Cultural Icons	A24

Fashion plays a significant role throughout Sofia Coppola's new movie.	\s
'The Marvels' has MCU's worst box office opening ever	'The Marvels' went lower, nearer, and slower with MCU's worst box office opening ever, grossing $47 million.	\s
THE MARVELS Officially Set For Lowest Domestic Opening In MCU History	The numbers are in, and with a $47 million to $52 million start, The Marvels looks set to have the lowest domestic opening weekend of any Marvel Studios movie...	\s
The Best Bang for Your Buck Events in Portland This Weekend: Nov 3–5, 2023	Legendary Makers Market, Diwali Festival, and More Cheap & Easy Events Under $15
 
 by EverOut Staff
 
 
 
 Get busy this weekend with a number of events that won't break the bank, from Legendary Makers Market: An Asian American Night Market to the Portland B…	\s
Hunger Games Prequel Opens No. 1 at Box Office, The Marvels Crumbles	'The Hunger Games: The Ballad of Songbirds and Snakes' is winning the pre-Thanksgiving weekend, while 'Trolls Band Together' is headed for a second-place finish with $30 million.	\s
Box Office Predictions: The Hunger Games Prequel to lead the pack	The last full weekend before Thanksgiving is here and with it brings a slew of new films aimed at all different audiences.
The post Box Office Predictions: The Hunger Games Prequel to lead the pack appeared first on JoBlo.	\s
International Insider: Spotlighting Turkey & Greece; AFM Week; World Tackles AI; Israel-Gaza	Good afternoon Insiders, Max Goldbart here. The clocks have gone back and it’s getting chilly but we’re here to warm your week with the very latest news and analysis. Read on and sign up here. To The Med Turkish delights: We spotlighted Turkey this week, and …	\s
SAG-AFTRA & Studios “Closer & Closer” To A Deal; More Talks Set For Thursday	EXCLUSIVE: There’s real movement in talks between SAG-AFTRA and the studios for a new three-year contract, No deal yet, but a framework is in place for a potential agreement, we hear. Back in negotiations Wednesday on day 111 of the actors strike, the two sid…	\s
Review: The Holdovers	The Holdovers blends feel-good and sorrowful themes thoughtfully to make a rewatchable flick. But the next watch will likely be over the holidays.
The post Review: The Holdovers appeared first on Chicago Reader.	\s
'The Marvel's' End Credits Scenes and What They Mean for the Future of the MCU	Spoilers for 'The Marvels' The last Marvel movie I saw, at home or in theaters, was Spider-Man: No Way Home. Before that, I'd seen every Marvel movie and every Marvel television series, but I didn't run out to see Doctor...
Read more...	\s
Barry Keoghan’s Naked Dance Scene in ‘Saltburn’ Needed 11 Takes	SPOILER ALERT: This story discusses major plot points, including the ending for “Saltburn.” In the final moments of Emerald Fennell’s “Saltburn,” Sophie Ellis-Bextor’s 2001 song, “Murder on the Dancefloor” pumps out over the speakers, while Barry Keoghan’s Ol…	\s
Robert Kardashian ‘wanted to marry’ Priscilla Presley—until she cooked for him	Priscilla Presley, who divorced Elvis 50 years ago after a turbulent six-year marriage, claimed in a Q-and-A event last week that she had “never wanted to marry after him” because “no one could ever match” the music legend. But Priscilla, 78, is not telling t…	\s
Thanks for Giving Us Nightmares: Eli Roth’s 6 Nastiest Movie Moments	In honor of Thanksgiving now playing in theaters, I decided to take a look at the filmography of Eli Roth. After spending a few days watching films like Cabin Fever, Hostel and The Green Inferno, I cried in the shower for about twenty minutes and am vegan now…	\s
THE HUNGER GAMES: THE BALLAD OF SONGBIRDS AND SNAKES Review: Satisfying, If You Know What You Want	Directed by Francis Lawrence, The Hunger Games: The Ballad of Songbirds and Snakes is the brand new prequel to The Hunger Games saga (2012-2015). It is set just over 60 years before Katniss Everdeen volunteers as a tribute in the 74th Hunger Games. The film f…	\s
With ‘Saltburn,’ Director Emerald Fennell Wants To Be A Villain	Getty Image/Merle Cooper

With ‘Saltburn,’ Emerald Fennell has created a pretty twisted tale.	\s
‘Sideways’ team reunites for ‘The Holdovers’	It took 10 years but with “The Holdovers,” Paul Giamatti and director Alexander Payne reunite for the first time since the Oscar-winning “Sideways.”	\s
Stellar cast makes ‘The Holdovers” a winner	With novel-like magic, “The Holdovers” makes you fall in love with its damaged miscreants.	\s
With ‘The Hunger Games’ Prequel, Tom Blyth Enters a Whole New Arena	On the eve of his star making turn as a pre-presidency Coriolanus Snow, the actor shares why he went no-contact with the original franchise cast, what he’d ask Donald Sutherland now, and how he’d approach the next chapter of Snow’s villainy.	\s
“Saltburn” Review: The Talented Mr. Quick	This piece was written during the 2023 SAG-AFTRA strike. The gateway to great art lies in caring for the artist.  A delicious sort of contradiction ... Read More	\s
‘The Holdovers’ Marks Director Alexander Payne’s Reunion With Paul Giamatti	Alexander Payne’s career of quietly incisive, off-kilter human comedies has rarely met a tonal match quite so perfect as actor Paul Giamatti. The Oscar-nominated actor so memorably captured the absurdity, heartache and rage of fledgling middle age in Payne’s …	\s
Conservatives Cheer 'Woke' Film 'The Marvels' Flopping	"Once again Disney has pushed a female-dominated cast onto the audience, and the failure has been spectacular," one social media user blasted.	\s
The Marvels Filmmaker Reveals Advice from Black Panther's Director	The Marvels has received generally positive reviews from critics and fans thus far, despite its meager turnout out at the box office for its opening holiday weekend. Unfortunately, it was the most disappointing opening weekend in modern MCU, but we have to re…	\s
Finally, a Gruesome ‘Thanksgiving’ Slasher Movie to Feast On	Sony Pictures Entertainment/YouTube Screenshot
After a decade away from big-screen horror, director Eli Roth (Hostel, The Green Inferno) returns to his favorite stomping grounds with Thanksgiving, a feature-length expansion of the 2007 faux-trailer that he c…	\s
Thanksgiving Director Eli Roth On Casting A Slasher And Putting Humor In Horror [Exclusive Interview]	/Film spoke with director Eli Roth, who adapted his Thanksgiving short into a full-length feature, about casting, the mixture of comedy and horror, and more.	\s
Emerald Fennell: We needed somebody as enigmatic and sexy as Barry Keoghan	Oscar winner’s new film stars Keoghan as a rough-hewn Oxford scholarship student who becomes an unlikely guest of a blue-blooded family	\s
The Nineteen-Seventies of “The Holdovers” Is Conveniently Sanitized	Richard Brody reviews Alexander Payne’s newest film, “The Holdovers,” starring Paul Giamatti, Dominic Sessa, and Da’Vine Joy Randolph.	\s
Rachel Zegler Says Jennifer Lawrence Joked When They First Met: Let’s Do a Photo ‘Where I’m Strangling You and Saying You’ll Never Take My Part’	Rachel Zegler is the new face of the “Hunger Games” franchise thanks to her role as Lucy Gray Baird in the prequel “The Hunger Games: The Ballad of Songbirds & Snakes.” During a recent visit to “The Kelly Clarkson Show,” Zegler recalled what it was like meeti…	\s
Priscilla Presley says Sofia Coppola’s depiction of her life is “right on”	It perhaps shouldn’t be news that the subject of a biopic signed off on a director’s vision of their own life, but in the wake of exploitative productions like Pam & Tommy and even Blonde, it’s nice to know that a film really did its homework. Luckily for sub…	\s
Iconic Directors: The 5 Best Alexander Payne Movies	Ever since I first saw the dark comedy Election in 1999, I’ve followed Alexander Payne closely through the highs of About Schmidt and Sideways to the lows of Downsizing. He’s a fantastic writer and director who tells captivating human stories packed with comp…	\s
Brie Larson Surprises Fans at 'The Marvels' Screening in New York	Brie Larson is heading out to promote her new movie The Marvels! Directed by Nia DaCosta, The Marvels is the latest MCU entry. In the film, Brie‘s Carol Danvers aka Captain Marvel fights alongside Kamala Khan aka Ms. Marvel (Iman Vellani) and Captain Monica R…	\s
How the Warm, Elegant Look of ‘The Holdovers’ Came Together	Alexander Payne’s The Holdovers is a period piece that’s more like a time capsule, with the look of film grain and even vintage lenses to make it feel like a movie that’s been locked in a vault since 1970, when it is set. Payne and cinematographer Eigil Bryld…	\s
Jacob Elordi Ate “A Pound of Bacon a Day” to Play Elvis Presley in Sofia Coppola’s Priscilla	The actor took inspiration from Elvis' favorite sandwich, the Fool's Gold Loaf.
Jacob Elordi Ate “A Pound of Bacon a Day” to Play Elvis Presley in Sofia Coppola’s Priscilla
Eddie Fu	\s
Thanksgiving Director Eli Roth Took Inspiration From This 1995 Horror Film [Exclusive]	Eli Roth is nothing if not a master of horror, and when he drew inspiration for Thanksgiving, he pulled from a little-seen masterpiece.	\s
Link Tank: Five Nights at Freddy’s Dominates Halloween Box Office	Five Nights at Freddy’s scares up the largest opening weekend ever for a live-action video game adaptation, surpassing the likes of the Sonic the Hedgehog movies. “Five Nights at Freddy’s tops the box office weekend with a global total of $130 million USD. Ea…	\s
Priscilla Presley on why she didn’t remarry after Elvis: ‘no one could ever match him’	I’m seeing Priscilla tomorrow and I can hardly wait. Even though the film has a SAG-AFTRA waiver and the actors have been promoting it, the most interesting promotional appearances are coming from Priscilla Presley herself. After many decades living in the sh…	\s
‘The Holdovers’: A tale of three loners, suffused with tenderness	Paul Giamatti, Da’Vine Joy Randolph and newcomer Dominic Sessa star in director Alexander Payne’s story of found family.	\s
How do you travel back to 1970s Massachusetts in the movies? Location, location, location.	Location manager Kai Quinlan helped make the Bay State a star in Alexander Payne’s new film, "The Holdovers."	\s
Jenna Ortega and Emilia Clarke among Harper’s Bazaar Women of the Year winners	Emilia Clarke and Jenna Ortega are among the winners at this year’s Harper’s Bazaar Women of the Year Awards 2023.	\s
There Are Only 2 Grindhouse Trailers Left After Eli Roth's Thanksgiving: Will They Become Movies Too?	Following the release of Eli Roth slasher Thanksgiving, only two more fake Grindhouse trailers remain - but will they receive movie adaptations too?	\s
'The Marvels' Melts Down at Box Office, Marking New Low for MCU	Since 2008's "Iron Man," the Marvel machine has been one of the most unstoppable forces in box-office history. Now, though, that aura of invincibility is showing signs of wear and tear. The superhero factory hit a new low with the weekend launch of "The Marve…	\s
Thanksgiving Director Eli Roth on Going From a Short to a Feature — and That Cheerleader Scene	Thanksgiving director Eli Roth sits down with IGN to open up about turning his short film into a full-blown feature - as well as that infamous cheerleader scene.	\s
Marvel Taught Us That Movies Need to Be Events, but the MCU No Longer Qualifies	"The Marvels" is a disaster while "Priscilla" and "The Holdovers" both stay strong. "Dream Scenario" and "Tiger 3" thrive in platform release.	\s
