	Article Title	Description	Coding	Movie
48	Eli Roth's ‘Thanksgiving’ is Actually Great	The horror director's fake ‘Grindhouse’ trailer is now a feature-length parade of inspired slasher set pieces.	Positive review	Thanksgiving
49	Box Office: ‘Hunger Games’ Gobbles Up $19.1 Million Opening Day, ‘Trolls 3’ Rolls to Second as ‘The Marvels’ Faces Brutal Drop	“The Ballad of Songbirds and Snakes” has caught some fire at the domestic box office. Lionsgate’s “Hunger Games” prequel earned about $19.1 million on its opening day from 3,776 locations, a figure that includes $5.75 million in Thursday previews. The new ins…	Performance	THG
50	Alexander Payne’s School for Sad Sacks	In writer-director Alexander Payne’s 2017 film, Downsizing, Paul Safranek (Matt Damon) chooses to shrink down and live at five inches tall. By getting small, he can live large and provide a better life for his wife; it will also help save the planet, we’re to…	Actor & Director	The Holdovers
51	Rachel Zegler’s New Movie Becomes Worst-Rated in Franchise History	Ahead of her Disney debut in director Marc Webb’s Snow White (2025) reboot, lead actress Rachel Zegler is gearing up for the premiere of her latest outing, The Hunger Games: The Ballad of Songbirds and Snakes (2023). The movie, which serves as a prequel to th…	Performance	THG
52	THE HUNGER GAMES: THE BALLAD OF SONGBIRDS AND SNAKES Review: Satisfying, If You Know What You Want	Directed by Francis Lawrence, The Hunger Games: The Ballad of Songbirds and Snakes is the brand new prequel to The Hunger Games saga (2012-2015). It is set just over 60 years before Katniss Everdeen volunteers as a tribute in the 74th Hunger Games. The film f…	Positive review	THG
53	Emerald Fennell on ‘Saltburn’: The Film So Filthy and Shocking We Have to Talk About It	To see Saltburn is to have a burning desire to talk about Saltburn.The film incites the kind of raging inferno inside of you that won’t be extinguished unless you’re able to immediatel…	Actor & Director	Saltburn
54	Final Fantasy 7 remake trilogy will link with Advent Children, confirms producer	Final Fantasy 7's remake trilogy will ultimately link up with Advent Children, making the film part of the remake canon.	Unrelated	Not relevant
55	I’ll Spend This Entire Weekend Thinking About That One Scene From “The Marvels”	There’s the kind of gay you can see, and the kind of gay you can touch, and then there’s the kind of gay that you just know.	Movie production	The Marvels
56	‘The Hunger Games: The Ballad of Songbirds & Snakes’ Review: Fallen Snow	The 18-year-old Coriolanus Snow (Tom Blyth) — future president of Panem, eventual tormentor of Katniss Everdeen — begins “The Hunger Games: The Ballad of Songbirds & Snakes” with his stomach growling. This slow-burning prequel by the franchise’s returning dir…	Movie production	THG
57	‘Thanksgiving’ Director Eli Roth on Making a Black Friday-Inspired Slasher and Lessons He Took From ‘The Idol’	The Vista Theatre hosted two premieres on Tuesday night — the first was for Thanksgiving, Eli Roth’s latest horror offering based on the fake trailer he created for the 2007 film Grindhouse. The second was for the movie house itself, which held its first prem…	Actor & Director	Thanksgiving
58	Hunter Schafer Reveals Why Her 'Hunger Games' Prequel Role Was a Challenge	Hunter Schafer is describing the challenges of her role in The Hunger Games: The Ballad of Songbirds and Snakes. In the Hunger Games prequel, directed by Francis Lawrence, Hunter plays Tigris, the loyal cousin of Coriolanus Snow (Tom Blyth). At the film’s New…	Actor & Director	THG
59	Priscilla Presley says Sofia Coppola’s depiction of her life is “right on”	It perhaps shouldn’t be news that the subject of a biopic signed off on a director’s vision of their own life, but in the wake of exploitative productions like Pam & Tommy and even Blonde, it’s nice to know that a film really did its homework. Luckily for sub…	Movie production	Priscilla
60	Sofia Coppola imagines Priscilla's teen years, living at Graceland with Elvis	I felt like my role was just to explain her experience, Coppola says of her new film, Priscilla. The filmmaker also has a new book, Archive, which collects documents from her eight movies.	Actor & Director	Priscilla
61	‘Hunger Games’ Star Tom Blyth Says He Wanted ‘People to Be Heartbroken’ by His Portrayal of a Young Monster	"The British actor tells TheWrap how — and why — he gave the young Coriolanus Snow his humanity in ""The Ballad of Songbirds and Snakes"""	Actor & Director	THG
62	You Can Thank an Octopus for the Grossest Sound Effects in Saltburn	‘Saltburn’’s sound supervisor spills all the slurpy, squelchy secrets behind the movie’s most outrageous scenes — and the key role an octopus played in that bathtub scene.	Movie production	Saltburn
63	The Ballad Of Songbirds & Snakes' 8 Biggest Hunger Games Prequel Book Changes	The Ballad of Songbirds and Snakes is faithful to the book by Suzanne Collins, but there are still a few changes. We break down what the film alters.	Movie production	THG
64	Margot Robbie & Husband Tom Ackerley Make Red Carpet Appearance at 'Saltburn' Premiere	Margot Robbie and Tom Ackerley are making a very rare red carpet appearance together! The married couple posed for photos while arriving at the premiere of Saltburn held on Tuesday evening (November 14) at The Theatre at Ace Hotel in Los Angeles. PHOTOS: Chec…	Actor & Director	Saltburn
65	‘The Holdovers’ Director Alexander Payne’s ‘Sideways’ Reunion With Paul Giamatti Was 20 Years in the Making	The Oscar-winning filmmaker tells TheWrap the role of a curmudgeonly history professor was written for the “Billions” actor before he even signed on	Actor & Director	The Holdovers
66	Miramax Loved ‘The Holdovers’ ’70s-Style Logo Design So Much It Ended Up Using It on Other Releases	Director Alexander Payne’s “The Holdovers” roots itself in 1970s nostalgia, right down to the main title design and the studio logos. However, neither company existed at the time. Distributor Focus Features was founded in 2002, while the film’s production com…	Movie production	The Holdovers
67	‘Hunger Games: Ballad Of Songbirds & Snakes’ Looks To Sing $100M+ Worldwide Opening – Preview	In what will be a revived week for moviegoing post actors strike heading into the Thanksgiving holiday, Lionsgate’s The Hunger Games: The Ballad of Songbirds & Snakes is looking to lead a global frame with a $100M+ start. The pic is one of four big studio wid…	Performance	THG
68	Border Town Drama ‘Radical’ With Eugenio Derbez Busts Out In U.S. Debut; ‘Priscilla’ Rocks Expansion – Specialty Box Office	Radical with Eugenio Derbez built on its smash opening in Mexico to hit no. 5 at the U.S. box office with a super $2.7 million at 416 theaters. The Pantelion film had delayed its debut Stateside by two weeks to skirt The Eras Tour juggernaut, allowing word of…	Performance	Priscilla
69	“The Killer” Misses	Anthony Lane reviews “The Killer,” David Fincher’s thriller starring Michael Fassbender, and “The Holdovers,” Alexander Payne’s tale of a seventies prep school, starring Paul Giamatti, Da’Vine Joy Randolph, and Dominic Sessa.	Backlash	The Holdovers
70	Nicolas Cage on Filming a Movie in Toronto at the Same Time as Cousin Sofia Coppola: “This Has Got to be Good Luck”	Nicolas Cage and Sofia Coppola surprisingly found themselves making movies in Toronto at the same time. The Oscar-winning actor told Entertainment Tonight, in an interview published online Friday, that while he was shooting the Kristoffer Borgli-directed come…	Unrelated	Not relevant
71	Emerald Fennell’s Poisoned Fantasies	The director is building a world of brutality and Millennial vibes, one movie at a time.	Actor & Director	Saltburn
72	THE MARVELS Debuts With $110M Worldwide; Best Opening Weekend For A Movie By A Black Female Director	The Marvels has failed to take off on its theaterical debut, with a disappointing $110.3 million global haul. However, this still marks the best opening weekend for a film by a Black female director.	Performance	The Marvels
73	With ‘The Hunger Games’ Prequel, Tom Blyth Enters a Whole New Arena	On the eve of his star making turn as a pre-presidency Coriolanus Snow, the actor shares why he went no-contact with the original franchise cast, what he’d ask Donald Sutherland now, and how he’d approach the next chapter of Snow’s villainy.	Actor & Director	THG
74	‘Nightmares in the Sky: Gargoyles and Grotesques’ Brings Stephen King to the Coffee Table [The Losers’ Club Podcast]	The sun is setting, it’ll be dark soon. Anxious, the Losers’ Club scans the nearby skyscrapers and gazes at the monstrosities watching from above. The stone monsters. The gargoyles! Join co-hosts Dan Pfleegor and Dan Caffrey as they celebrate the 35th anniver…	Unrelated	Not relevant
75	THE MARVELS' CinemaScore Is Tied With ETERNALS & ANT-MAN 3 As Lowest In MCU History	"Despite a strong audience score on Rotten Tomatoes, The Marvels has received a ""B"" CinemaScore, tying it with Eternals and Ant-Man and the Wasp: Quantumania as the lowest in MCU history..."	Performance	The Marvels
76	Review: ‘The Marvels’ Is Exactly The Great, Fun Superhero Movie Marvel Studios Needs	The Marvels will top the box office this weekend, but the superhero sequel looks sadly destined to underperform.	Positive review	The Marvels
77	We Didn't Need The Evil White Guy Origin Story For 'Hunger Games'	Movies about how bad men rose to infamy are too often met with unfair scrutiny. ‘Ballad of Songbird and Snakes,’ though, deserves that scorn.	Backlash	THG
78	The MCU is losing the common moviegoer, and that's a huge problem for its survival	The Marvel Cinematic Universe might just be on its last legs.	Performance	The Marvels
79	Emilia Clarke, Jenna Ortega and Alessia Russo win at Women of the Year awards	Actresses Emilia Clarke and Jenna Ortega were among the winners at this year's Harper's Bazaar Women of the Year Awards.	Actor & Director	Priscilla
80	‘Saltburn’ Composer Anthony Willis On Emerald Fennell’s “Dirty Sense” And Templar Knights	It wasn’t a tough decision for Anthony Willis when Emerald Fennell asked him to compose Saltburn, the drama that stars Barry Keoghan as a young and nerdy Oxford university student who becomes obsessed with a popular and wealthy student (Jacob Elordi). Willis …	Movie production	Saltburn
81	The Hunger Games: The Ballad of Songbirds & Snakes review: a worthwhile prequel	The Hunger Games: The Ballad of Songbirds & Snakes is an entertaining, overlong prequel. It's now playing in theaters nationwide.	Positive review	THG
82	Thanksgiving Director Eli Roth on Going From a Short to a Feature — and That Cheerleader Scene	Thanksgiving director Eli Roth sits down with IGN to open up about turning his short film into a full-blown feature - as well as that infamous cheerleader scene.	Actor & Director	Thanksgiving
83	The Nineteen-Seventies of “The Holdovers” Is Conveniently Sanitized	Richard Brody reviews Alexander Payne’s newest film, “The Holdovers,” starring Paul Giamatti, Dominic Sessa, and Da’Vine Joy Randolph.	Movie production	The Holdovers
84	‘The Hunger Games: Ballad of Songbirds & Snakes’ Is the Rare Good Prequel	It’s possible, Francis Lawrence’s movie suggests, to do something as cynical as a brand extension with care and insight.	Positive review	THG
85	Jacob Elordi Turned Down A ‘Superman’ Audition & Has No Interest In Superhero Roles Right Now	Jacob Elordi has quickly become one of the most sought-after actors in the world. Thanks to a scene-stealing role in “Euphoria,” as well as some acclaimed performances since, he’s seemingly always in the conversation when it comes to the next generation of ma…	Unrelated	Not relevant
86	MOVIES: A sweet one for the holidays, Denys Arcand on our woke conflicts and a new one from Marvel	Also: extreme pursuit of fame and re-imagining your life in high school	Movie production	The Marvels
87	Rachel Zegler Says Jennifer Lawrence Joked When They First Met: Let’s Do a Photo ‘Where I’m Strangling You and Saying You’ll Never Take My Part’	Rachel Zegler is the new face of the “Hunger Games” franchise thanks to her role as Lucy Gray Baird in the prequel “The Hunger Games: The Ballad of Songbirds & Snakes.” During a recent visit to “The Kelly Clarkson Show,” Zegler recalled what it was like meeti…	Actor & Director	THG
88	Will There Be a Sequel to ‘The Hunger Games: The Ballad of Songbirds and Snakes’? What We Know About the Franchise’s Future	Will we see more of Lucy Gray?	Movie production	THG
89	Sweet Nothings: On the Emptiness of Sofia Coppola’s Priscilla	At the conclusion of Priscilla Beaulieu Presley’s 1985 memoir, Elvis and Me, she writes that Elvis “was, and remains, the greatest influence in my life.” Priscilla’s formative years with the King of Rock and Roll are what constitute much of her plainspoken ye…	Movie production	Priscilla
90	‘The Holdovers’ Review: A Very Medicated Christmas	The Holdovers tells the story of faculty, staff and students held over the winter break at a New England boarding school. If there’s one thing ... Read More	Movie production	The Holdovers
91	Box Office Results: Hunger Games Prequel Rises to the Top as Marvels Sinks	There are plenty of pros and cons at the box office this week. We’ll start with the good news. The Hunger Games prequel, The Ballad of Songbirds & Snakes, opened with a decent but not spectacular $44 million, enough to propel the Francis Lawrence-directed pic…	Performance	THG
92	Sex, style and spoiled rich boys: Promising Young Woman director returns with a fever dream thriller	Emerald Fennell is back with a thrilling, dark satire set in an English mansion that doesn't shy away from the 'sticky and difficult' stuff.	Positive review	Saltburn
93	Stellar cast makes ‘The Holdovers” a winner	With novel-like magic, “The Holdovers” makes you fall in love with its damaged miscreants.	Positive review	The Holdovers
94	Priscilla Presley Says She Was ‘Concerned’ About ‘Priscilla’ Film Prior to Release	One day after a report claimed that Lisa Marie Presley slammed the new film before her passing, her mother praised it while at an event in Las Vegas.	Movie production	Priscilla
95	Thanksgiving review: a gruesome, cutthroat horror comedy	Eli Roth's Thanksgiving is a gloriously violent, fun horror comedy. It's now playing in theaters nationwide.	Movie production	Thanksgiving
96	The Marvels hit with worst box office opening for any MCU movie to date with just S$64 million	<![CDATA[ The 2019 Brie Larson-led Captain Marvel sequel is the 33rd installment in the Marvel Cinematic Universe (MCU). ]]>	Performance	The Marvels
97	Sofia Coppola Chats About Her Latest Gig: A Luxury Cashmere Collection, Barrie + Sofia Coppola	Coppola hosted a party Tuesday night at the Invisible Collection in New York to introduce the collection.	Unrelated	Not relevant
98	‘The Marvels’ Director Nia DaCosta Stuns At Special Premiere Event In Vegas, Teams Up With Ms. Marvel For Super-Powered Surprise	Visionary director Nia DaCosta commands the carpet at 'The Marvels' special screening event in Las Vegas, Nevada	Movie production	The Marvels
99	Priscilla Presley reveals why she never remarried after Elvis | CNN	Priscilla Presley is talking about why she never remarried after her six-year marriage to Elvis Presley ended.	Movie production	Priscilla
100	Breaking Down the Ending of Eli Roth’s New Holiday Slasher Thanksgiving	Breaking down the twist ending of Eli Roth's new holiday slasher	Movie production	Thanksgiving
101	The Marvels Director Nia DaCosta Wants To Unite Two X-Men Heroes Next	"The Marvels Director Nia DaCosta Wants To Unite Two X-Men Heroes Next Following her admirable contribution to the Candyman franchise, director Nia DaCosta has been on the rise. In the ""Captain Marvel"" sequel, ""The Marvels,"" the filmmaker reunites with ""Candym…"	Actor & Director	The Marvels
102	‘Saltburn’ Stars Jacob Elordi and Barry Keoghan on Swapping Bodily Fluids, Gravesite Sex and More	SPOILER ALERT: This story contains descriptions of key scenes and storylines in “Saltburn.” Oscar-winning filmmaker Emerald Fennell’s new twisted thriller, “Saltburn,” includes several graphic scenes that have left moviegoers debating whether to be titillated…	Actor & Director	Saltburn
103	Box Office Predictions: The Marvels looks to have one of the worst MCU debuts	With many fans growing tired of the MCU formula, The Marvels looks to have a debut in the bottom three of all 33 films.	Performance	The Marvels
104	How do you travel back to 1970s Massachusetts in the movies? Location, location, location.	"Location manager Kai Quinlan helped make the Bay State a star in Alexander Payne’s new film, ""The Holdovers."""	Movie production	The Holdovers
105	In ‘Priscilla,’ Sofia Coppola Imagines Priscilla Presley's Inner Life. Presley's 1985 Memoir Reveals It	The director finds a perfect Sofia Coppola protagonist in ‘Elvis & Me.’ But the book itself has even more to say about both the Presleys.	Movie production	Priscilla
106	'Saltburn' Premiere Red Carpet	https://instagram.com/p/CzrqIBPSXGfSaltburn had its Los Angeles premiere last night, and stars Jacob Elordi, Barry Keoghan, Carey Mulligan, Archie Madekwe, producer Margot Robbie, and director Emerald Fennell were in attendance.https://instagram.com/p/Czp6YN5…	Movie production	Saltburn
107	Pedro Pascal Seems Like A Risky Choice For Fantastic Four – And That's A Great Thing	Pedro Pascal is joining the Marvel Cinematic Universe as Reed Richards. That may be a slightly risky choice, but it seems like a very smart move for Marvel.	Unrelated	Not relevant
108	‘Hunger Games: The Ballad of Songbirds and Snakes’: How Lucy Gray’s Rainbow Dress Connects to Katniss	“You may know me from other stuff, but I don’t use a lot of colors, except when necessary,” says renowned costume designer Trish Summerville. So, when it came to designing the main outfit worn by Rachel Zegler’s Lucy Gray in “The Hunger Games: The Ballad of S…	Movie production	THG
109	Priscilla Music Supervisor Details Challenge Of Avoiding Elvis Songs For The Film	Priscilla's music supervisor Randall Poster explains how difficult yet &quot;exciting&quot; it was to avoid using Elvis songs for the film, which is out now.	Movie production	Priscilla
110	Emerald Fennell Is ‘Thrilled’ by the Way ‘Saltburn’ Leaves Audiences ‘Physically Shaken’	"The Oscar-winning writer-director talks to IndieWire about her ""tricky"" sophomore feature starring Barry Keoghan, which still has managed to ""connect deeply with people,"" whether they like it or not."	Positive review	Saltburn
111	How Cailee Spaeny Became Priscilla Presley	Inside the endless fittings, giant wigs, intimate conversations, and single-take risks that went into the creation of an indelible heroine for Sofia Coppola’s new film.	Movie production	Priscilla
112	‘The Marvels’ Faces Anti-‘Woke’ Backlash After Box Office Flop—Echoing ‘Captain Marvel’ Attacks	Both “The Marvels” and “Captain Marvel” star Oscar winner Brie Larson, who has faced sexist attacks for comments she has made pushing for diversity in Hollywood and film criticism.	Backlash	The Marvels
113	Sofia Coppola Wore the Jeans-and-Flats Outfit French Girls Love	Director Sofia Coppola isn't often in front of the camera but always has incredible style. Steal her French Girl-inspired look featuring jeans and flats.	Unrelated	Not relevant
114	‘The Holdovers’: David Hemingson On Writing For Paul Giamatti, Channelling His Boarding School Experiences & More	After 25 years of writing in Hollywood, David Hemingson is having a moment. A writer and producer on television shows such as “Just Shoot Me!,” “American Dad,” the cult favorite “Don’t Trust the B—- in Apt. 23,” and, “Whiskey Cavalier,” Hemingson is looking a…	Movie production	The Holdovers
115	Priscilla: Lana Del Ray almost featured on movie's soundtrack, says Sofia Coppola	Lana Del Ray has been an ardent fan of Elvis Presley and Priscilla. The singer was about to be part of the movie but conflicting schedules came in the way. Although Coppola extended an invitation to the Grammy-nominated artist for the film's premiere, Lana De…	Movie production	Priscilla
116	Even More Fantastic Four Casting Rumors Point Towards a Legendary Villain	Tom Hardy confirms filming has resumed on Venom 3. Eli Roth digs deep into designing Thanksgiving’s villain. Harley Quinn will return to Max for another season. Plus, get a look at Disney’s Percy Jackson series. Spoilers, assemble!Read more...	Movie production	Thanksgiving
117	Review: 'Saltburn' lays out a rich spread of class envy as one vulture swoops in to feed	"Writer-director Emerald Fennell, the ""Promising Young Woman"" Oscar winner, returns with another provocative drama, this one starring Barry Keoghan and Jacob Elordi."	Movie production	Saltburn
118	Where Is Priscilla Presley Now? What We Know About the Inspiration Behind the Sofia Coppola Film	The movie is based on her real life in the '60s, so there's a bit to catch up on.	Movie production	Priscilla
119	THANKSGIVING Review: Eli Roth Serves Up A New Holiday Horror Classic	One year after a Black Friday (ish) stampede kills multiple residents of Plymouth, Massachusetts, a costumed killer is out for revenge against anyone even remotely involved in the tragedy in Eli Roth's years-in-the-making Thanksgiving. What famously began as …	Positive review	Thanksgiving
120	The 2024 Oscars BuzzMeter is here to trumpet the contenders that will be and the ones that should be	Our BuzzMeter film experts are back to predict what contenders will get Oscar buzz and spotlight what they think deserves awards attention in 10 academy awards categories. Vote in the online polls!	Unrelated	Not relevant
121	How Snow Takes Center Stage in the Hunger Games Prequel	The Ballad of Songbirds and Snakes sees a younger Coriolanus Snow on a journey that will forever alter his destiny. Find out how he is really the Hunger Games prequel’s true protagonist.	Movie production	THG
122	Review: The Holdovers	The Holdovers blends feel-good and sorrowful themes thoughtfully to make a rewatchable flick. But the next watch will likely be over the holidays.	Movie production	The Holdovers
123	Thanksgiving Director Eli Roth Took Inspiration From This 1995 Horror Film [Exclusive]	Eli Roth is nothing if not a master of horror, and when he drew inspiration for Thanksgiving, he pulled from a little-seen masterpiece.	Actor & Director	Thanksgiving
124	Emerald Fennell has already conquered Hollywood. Now she wants to follow her 'crushes'	The Oscar-winning 'Promising Young Woman' screenwriter is back in the director's seat with 'Saltburn,' produced by Margot Robbie and co-starring Carey Mulligan.	Actor & Director	Saltburn
125	How ‘Thanksgiving’ Director Eli Roth Turned a Fake Trailer Into His Best-Reviewed Movie	Thanksgiving filmmaker Eli Roth has been dreaming of a Thanksgiving-themed slasher movie since he was 12 years old, and he thought he’d forever scratched that itch when he made a fictitious trailer for a movie called Thanksgiving inside of Robert Rodriguez an…	Actor & Director	Thanksgiving
126	‘The Holdovers’: A tale of three loners, suffused with tenderness	Paul Giamatti, Da’Vine Joy Randolph and newcomer Dominic Sessa star in director Alexander Payne’s story of found family.	Movie production	The Holdovers
127	‘The Marvels’ melts down at the box office, marking a new low for the MCU	The superhero factory hit a new low with the weekend launch of “The Marvels,” which opened with just $47 million, […]	Performance	The Marvels
128	Thanksgiving Director Eli Roth Kills Misconceptions Around Horror Movie Censorship	Learn More It's not unusual for the Motion Picture Association of America to scrutinize the works of horror filmmakers, especially when it comes to slicing out explicit, NC-17-level gore in movies going for an R rating. But horror maestro Eli Roth has become …	Actor & Director	Thanksgiving
129	Duchess of Sussex says she is ‘thrilled’ about return to Hollywood	Former Suits actress Meghan Markle said she is “thrilled” to have returned to the entertainment industry with her and husband Prince Harry’s production company.	Unrelated	Not relevant
130	Emerald Fennell Is “So Proud of Everyone” Who Participated in the Actors Strike	Emerald Fennell reacted to the end of the actors strike ahead of a screening of her upcoming film, Saltburn. The Oscar-winning writer hit the red carpet in New York City on Thursday with star and Oscar nominee Barry Keoghan to celebrate the MGM drama. The scr…	Actor & Director	Saltburn
131	T LOunge for November 6th, 2023	Nando’s Restaurant – Clydebank, UK It’s MONDAY, darlings! Let’s spend it a fancy chicken shop making lots of noise and clatter, yes? Yes! Pull up a chair or slide into a banquette, because we have many unimportant things to show you today.     As She Prepares…	Unrelated	Not relevant
0	Did Priscilla Presley Ever Remarry After Her Divorce From Elvis?	(Getty Image) The businesswoman and actress is the focus of the latest Sofia Coppola film, which concerns her marriage to Elvis Presley.	Movie production	Priscilla
